{
  "$schema": "http://json-schema.org/draft-07/schema#",
  "$id": "https://shelvia.net/schema/context-pack.schema.json",
  "title": "Shelvia Context Pack",
  "description": "A portable, reviewed bundle of project context handed from one AI tool to the next.",
  "type": "object",
  "additionalProperties": false,
  "required": ["spec_version", "project_summary"],
  "properties": {
    "spec_version": {
      "type": "string",
      "const": "0.1",
      "description": "The Context Pack format version this document targets. Only \"0.1\" is supported today; unknown versions are rejected rather than silently accepted.",
      "examples": ["0.1"]
    },
    "generated_at": {
      "type": "string",
      "format": "date-time",
      "description": "When the pack was generated (ISO 8601)."
    },
    "category": {
      "type": "string",
      "enum": ["general", "coding", "research", "writing", "design"],
      "default": "general",
      "description": "The kind of work this pack focuses on."
    },
    "task": {
      "type": "string",
      "description": "What the next tool is being asked to do with this pack."
    },
    "work_phase": {
      "type": "string",
      "enum": ["research", "plan", "implement"],
      "description": "The phase this pack frames the next tool for."
    },
    "project_summary": {
      "type": "string",
      "minLength": 1,
      "maxLength": 20000,
      "description": "A short plain-language description of the project."
    },
    "current_direction": {
      "type": ["string", "null"],
      "maxLength": 20000,
      "description": "Where the project is heading right now."
    },
    "decisions": {
      "type": "array",
      "maxItems": 1000,
      "description": "Approved decisions, with reasoning carried alongside.",
      "items": { "$ref": "#/$defs/decision" }
    },
    "sources": {
      "type": "array",
      "maxItems": 1000,
      "description": "Trusted sources backing the work.",
      "items": { "$ref": "#/$defs/source" }
    },
    "prompts": {
      "type": "array",
      "maxItems": 1000,
      "description": "Reusable prompts that worked well for this project.",
      "items": { "$ref": "#/$defs/prompt" }
    },
    "constraints": {
      "type": "array",
      "maxItems": 1000,
      "description": "Hard rules the next tool must respect.",
      "items": { "type": "string", "maxLength": 8000 }
    },
    "boundaries": {
      "type": "array",
      "maxItems": 1000,
      "description": "Stated guardrails for this handoff.",
      "items": { "type": "string", "maxLength": 8000 }
    },
    "what_to_avoid": {
      "type": "array",
      "maxItems": 1000,
      "description": "Approaches already ruled out.",
      "items": { "type": "string", "maxLength": 8000 }
    },
    "open_questions": {
      "type": "array",
      "maxItems": 1000,
      "description": "Unresolved questions the next tool should be aware of.",
      "items": { "type": "string", "maxLength": 8000 }
    },
    "next_steps": {
      "type": "array",
      "maxItems": 1000,
      "description": "The recommended next actions.",
      "items": { "type": "string", "maxLength": 8000 }
    },
    "version_history": {
      "type": "array",
      "maxItems": 1000,
      "description": "Notable prior versions or milestones.",
      "items": { "$ref": "#/$defs/version_entry" }
    },
    "definition_of_done": {
      "type": ["string", "null"],
      "maxLength": 20000,
      "description": "How the next tool will know the task succeeded."
    },
    "recommended_assistant": {
      "type": "object",
      "description": "What kind of assistant to open next. Never a vendor name.",
      "additionalProperties": false,
      "required": ["type", "reason"],
      "properties": {
        "type": {
          "type": "string",
          "enum": ["coding", "research", "writing", "design", "planning", "debugging", "general"]
        },
        "reason": { "type": "string", "minLength": 1 }
      }
    }
  },
  "$defs": {
    "decision": {
      "type": "object",
      "additionalProperties": false,
      "required": ["title"],
      "properties": {
        "id": { "type": "string" },
        "title": { "type": "string", "minLength": 1 },
        "body": { "type": ["string", "null"] },
        "rationale": { "type": ["string", "null"] },
        "tradeoffs": { "type": ["string", "null"] },
        "outcome": { "type": ["string", "null"] },
        "evidence": {
          "type": "array",
      "maxItems": 1000,
          "items": {
            "type": "object",
            "additionalProperties": false,
            "required": ["claim"],
            "properties": {
              "claim": { "type": "string", "minLength": 1 },
              "source": { "type": ["string", "null"] }
            }
          }
        }
      }
    },
    "source": {
      "type": "object",
      "additionalProperties": false,
      "required": ["label", "url"],
      "properties": {
        "id": { "type": "string" },
        "label": { "type": "string", "minLength": 1, "maxLength": 2000 },
        "url": { "type": "string", "format": "uri", "maxLength": 4000, "pattern": "^https?://" },
        "trust_grade": {
          "type": "string",
          "enum": ["primary", "reputable", "community", "unverified"],
          "description": "How much the next tool should lean on this source."
        },
        "bound_claim": { "type": ["string", "null"] }
      }
    },
    "prompt": {
      "type": "object",
      "additionalProperties": false,
      "required": ["text"],
      "properties": {
        "id": { "type": "string" },
        "text": { "type": "string", "minLength": 1 },
        "tool": { "type": ["string", "null"] }
      }
    },
    "version_entry": {
      "type": "object",
      "additionalProperties": false,
      "required": ["label", "status"],
      "properties": {
        "label": { "type": "string", "minLength": 1 },
        "status": { "type": "string", "minLength": 1 },
        "summary": { "type": ["string", "null"] }
      }
    }
  }
}
