{
  "spec_version": "0.1",
  "generated_at": "2026-07-29T09:10:00Z",
  "category": "research",
  "task": "Recommend Supabase or Firebase as the backend for a small team's MVP, with the reasoning and sources carried along.",
  "work_phase": "research",
  "project_summary": "A two-person team is choosing a backend-as-a-service for an MVP: auth, a relational-ish data model, file storage, and realtime updates. They want to move fast now without a painful migration later.",
  "current_direction": "Leaning toward a Postgres-based option for SQL and portability, but the realtime and vendor-lock-in trade-offs are not yet settled.",
  "decisions": [
    {
      "title": "Adopt Supabase for the MVP",
      "body": "Use Supabase (managed Postgres + auth + storage + realtime) as the backend.",
      "rationale": "The team wants relational modelling and an exit path; Supabase is Postgres, so the data and much of the logic stay portable.",
      "tradeoffs": "Firebase's realtime + offline story is more mature; we accept that for the portability and SQL benefits.",
      "outcome": "Recorded as the approved direction pending the load assumptions in open questions.",
      "evidence": [
        {
          "claim": "Supabase is built on Postgres, so schemas and SQL are portable to any Postgres host",
          "source": "https://supabase.com/docs/guides/database/overview"
        },
        {
          "claim": "Firebase's Firestore is a document database with strong client SDKs and offline persistence",
          "source": "https://firebase.google.com/docs/firestore"
        }
      ]
    }
  ],
  "sources": [
    {
      "label": "Supabase — Database overview",
      "url": "https://supabase.com/docs/guides/database/overview",
      "trust_grade": "primary",
      "bound_claim": "Supabase is built on Postgres, so schemas and SQL are portable to any Postgres host"
    },
    {
      "label": "Firebase — Cloud Firestore",
      "url": "https://firebase.google.com/docs/firestore",
      "trust_grade": "primary",
      "bound_claim": "Firestore is a document database with strong client SDKs and offline persistence"
    },
    {
      "label": "Supabase — Pricing",
      "url": "https://supabase.com/pricing",
      "trust_grade": "primary"
    }
  ],
  "constraints": [
    "The recommendation must be backed by a cited source, not preference alone.",
    "Relational modelling and a migration exit path are hard requirements."
  ],
  "boundaries": [
    "Compare only Supabase and Firebase; do not introduce a third option unless a requirement can't be met.",
    "Do not state pricing figures without linking the current pricing page."
  ],
  "what_to_avoid": [
    "Presenting vendor marketing claims as verified facts.",
    "Recommending a NoSQL document model when the team asked for relational."
  ],
  "open_questions": [
    "What is the expected concurrent-realtime-connection count at launch?",
    "Is mobile offline persistence a launch requirement or a later nice-to-have?"
  ],
  "next_steps": [
    "Confirm the realtime + offline requirements against the two open questions.",
    "Prototype auth + one realtime table on Supabase to de-risk the choice.",
    "Record the final decision with its bound sources once the load assumptions are confirmed."
  ],
  "definition_of_done": "A cited recommendation that names the winner, states the key trade-off accepted, links every factual claim to a source, and lists what remains uncertain.",
  "recommended_assistant": {
    "type": "research",
    "reason": "This is a source-backed comparison and decision, not an implementation task."
  }
}
